{
  "schema": "2.0",
  "lessonId": "0198c5b2-7a3e-7cc0-9f10-2b7f4d6e8a07",
  "tenantId": "0198c5b2-0000-7cc0-9f10-aaaa4d6e8a55",
  "courseRef": "course-che-111",
  "curriculumRef": {
    "value": "NCE Chemistry Year 1 — CHE 111 General Chemistry",
    "source": "pipeline"
  },
  "version": 1,
  "title": "Future Major Version — Cannot Play",
  "language": "en-NG",
  "blocks": [
    {
      "id": "blk-001",
      "type": "slide",
      "title": "A v2.0 slide",
      "citations": [],
      "body": "A breaking-change script. Consumers built for major 1 must report unsupportedMajor, never a generic error list."
    }
  ]
}
